{
  "schemaVersion": 1,
  "id": "n_0000_beam_rhythm",
  "searchId": "s_20260720_lighthouse_in_a_storm",
  "parents": [],
  "generation": 0,
  "edgeType": "root",
  "searchRole": "readable",
  "lifecycleStatus": "sealed",
  "objectiveRevision": 1,
  "createdAt": "2026-07-20T07:27:42.129Z",
  "sealedAt": "2026-07-20T07:27:42.129Z",
  "title": "Beam Rhythm",
  "hypothesis": "A single readable timing window can create tense, hopeful one-more-try play without a tutorial.",
  "changesFromParents": [],
  "preserve": [
    "one-button input",
    "visible lighthouse consequence",
    "one-minute session"
  ],
  "provenance": {
    "briefId": "fixture-first-round-readable",
    "report": "Tests whether clear timing and immediate beam feedback are sufficient to carry the lighthouse fantasy."
  },
  "runtime": {
    "entry": "game/index.ts",
    "viewport": {
      "width": 960,
      "height": 540
    },
    "orientation": "landscape",
    "seed": 41832,
    "actions": [
      "primary",
      "restart"
    ]
  },
  "validation": {
    "schema": "passed",
    "typecheck": "passed",
    "bundle": "passed",
    "boot": "passed",
    "consoleErrors": 0,
    "screenshot": "preview.png"
  }
}
