{
  "schemaVersion": 1,
  "id": "n_0003_pulse_under_pressure",
  "searchId": "s_20260720_lighthouse_in_a_storm",
  "parents": [
    "n_0000_beam_rhythm",
    "n_0001_keeper_s_choice"
  ],
  "generation": 1,
  "edgeType": "crossover",
  "searchRole": "crossover",
  "lifecycleStatus": "sealed",
  "objectiveRevision": 1,
  "createdAt": "2026-07-20T07:28:52.210Z",
  "sealedAt": "2026-07-20T07:28:52.210Z",
  "title": "Pulse Under Pressure",
  "hypothesis": "Readable timing becomes more meaningful when every hit visibly restores a beam that is continuously losing power.",
  "changesFromParents": [
    "adds one visible shared power reserve to Beam Rhythm",
    "removes Keeper's Choice's three-way dashboard"
  ],
  "preserve": [
    "Beam Rhythm's timing clarity",
    "Keeper's Choice's visible loss of power",
    "one-button input"
  ],
  "provenance": {
    "briefId": "fixture-round-two-crossover",
    "report": "Tests the explicit synthesis requested by the demo: readable timing with a physical, continuously visible power consequence."
  },
  "runtime": {
    "entry": "game/index.ts",
    "viewport": {
      "width": 960,
      "height": 540
    },
    "orientation": "landscape",
    "seed": 52901,
    "actions": [
      "primary",
      "restart"
    ]
  },
  "validation": {
    "schema": "passed",
    "typecheck": "passed",
    "bundle": "passed",
    "boot": "passed",
    "consoleErrors": 0,
    "screenshot": "preview.png"
  }
}
